{
  "schema_version": "2.0",
  "ts": "2026-10-10T09:15:02.113Z",
  "level": "info",
  "enterprise": "ENT-A",
  "application": "APP01",
  "namespace": "jengasec-ent-a-app01",
  "event": "request_completed",
  "outcome": "denied",
  "request_id": "req-contract-001",
  "source_ip": "10.60.2.14",
  "user_id": "acct-1842",
  "method": "POST",
  "path": "/api/v1/transfers",
  "status": 403,
  "action": "create_transfer",
  "detail": {
    "route": "transfers.create"
  }
}
