{
  "schema_version": "2.0",
  "ts": "2026-10-10T12:00:00.000Z",
  "level": "info",
  "enterprise": "ENT-A",
  "application": "APP01",
  "namespace": "jengasec-ent-a-app01",
  "event": "request_completed",
  "outcome": "success",
  "request_id": "smoke-fixture-001",
  "source_ip": "127.0.0.1",
  "user_id": "reference-user-1",
  "target_id": "reference-request",
  "method": "GET",
  "path": "/emit",
  "status": 200,
  "action": "emit_reference_event",
  "detail": {
    "route": "/emit"
  }
}
